{"canonical_sha256":"a68473c8942ef024a29f563786aa09f335fb3aed1d34c4038c88478d0a40d824","fidelity":{"geometry":"VERIFIED","limitations":["CPU Pillow ordered alpha composition; GPU WBOIT, native action-wide billboard bounds and cross-GPU pixel parity are not verified.","Deterministic sequence of PNG preview frames."],"native_pixel_parity":"UNVERIFIED","overall":"PARTIAL"},"frame_count":8,"frames":[{"bounds":[110,114,148,203],"duration_ms":null,"filename":"frame_000.png","frame":0,"png_sha256":"fc23a63308184886b6c8f3b1d333df2f486db42cd2b547f98d625762f8bfffb6"},{"bounds":[111,115,147,204],"duration_ms":null,"filename":"frame_001.png","frame":1,"png_sha256":"b04e05815f7653bc0fedf88e6277fed06ed567b2c494db6426642ff9dfae9872"},{"bounds":[113,117,146,206],"duration_ms":null,"filename":"frame_002.png","frame":2,"png_sha256":"06aaa0efb5cc7679d9aef0020bc8d5b749829db29626691e02886004df1b9a8a"},{"bounds":[111,116,147,206],"duration_ms":null,"filename":"frame_003.png","frame":3,"png_sha256":"bdb1d4eab1b0de1f577dbd6febd265446445c7abdc656672dc73c6bbefd0c387"},{"bounds":[110,114,148,203],"duration_ms":null,"filename":"frame_004.png","frame":4,"png_sha256":"759443b2bea3bebab4c20522f147c1be429e1000a56a3acb3fdb8d459a21c824"},{"bounds":[111,115,147,204],"duration_ms":null,"filename":"frame_005.png","frame":5,"png_sha256":"7275367db22b3cd9e8f0b7a4975e6867f128f80d7fffdcb0ce9c1a1ffefd66b6"},{"bounds":[112,117,146,207],"duration_ms":null,"filename":"frame_006.png","frame":6,"png_sha256":"bdf94c017fac431672eb054865ccef6a4333dfdadab36c4b60b0f0cf176ad960"},{"bounds":[111,116,147,207],"duration_ms":null,"filename":"frame_007.png","frame":7,"png_sha256":"4dd185dd9042cf874fc8186f6254a9bf58e62914303268b1cd5f987269496cfd"}],"overlays":["anchors"],"schema":"rsf.sequence-manifest/v1","selection":{"action":"Walk","camera_direction":0,"category":"player","direction":null,"slot":8,"view":0},"semantics":{"export":"1.0.0","geometry":"1.0.0","renderer":"1.1.0","timing":"1.0.0"},"sequence_sha256":"54a4ff1d7293cc5faf8377051d9372c28b40586f75790feb822937e50cf7944c","sources":{"body_act":"a82086ba005506a16ee0740ebd1d33c43de8cc4ee1a622ea933ff9e0502c1c77","body_spr":"7f4efe357b0f80e71ba2dcdb93d1c110988b1b8f382e1dbfc722e3a2cf85a533","head_act":"96cb4c7daada65ead29ade650c34da1cba93937d3b360c5468506c3d056219de","head_spr":"dfc548c5cfd9aeb66616c5912df78773c2798834f9412a309a5a2b4f5868ac95"},"timing":{"looping":null,"mode":"MANUAL","runtime_rule":null,"source_delay":3.0}}
